id,title,descripción,slug,proposer,created,clasification,nro_supports
505,Más espacios públicos y comunitarios para la práctica del deporte y vida sana,"-	Articular los esfuerzos realizados desde el área de la salud con aquellos emanados desde el sistema escolar a fin de que las acciones tengan repercusiones para el % de los casos de NNA que no presentan depresión, pero si riesgo suicida.
-	Destinar recursos a la investigación en suicidio infantil y adolescente.
-	Realizar articuladamente entre MINSAL, MINEDUC, policías y fundaciones que trabajan el tema, una sistematización permanente y sostenida respecto a los datos de niños, niñas y adolescentes que han presentado riesgo suicida.",falta-de-espacios-publicos-y-comunitarios-para-la-,mhurtado,2017-11-05T17:05:58.525395Z,cultura,128
478,Que los padres salgan del trabajo a la misma hora que nosotros del colegio,"- Crear un sistema de control que asegure que las primeras diligencias investigativas logren levantar pruebas suficientes para resolver los delitos.

- Centrar la investigación de la Fiscalía en focos y bandas criminales, mercados de bienes robados y narcotráfico, todas actividades relacionadas con la comisión de otros delitos.
		
- Sacar del sistema penal a infractores primerizos con adicciones, sometiéndolos a la acción de los Tribunales de Tratamiento de Drogas en las capitales regionales, ya que han mostrado ser efectivos en la rehabilitación y en evitar el contagio criminógeno.

- Crear tribunales y salas especializadas en el juzgamiento de jóvenes infractores de manera de establecer sanciones que promuevan su reintegración social.
		
- Mejorar las medidas de protección a víctimas de violencia intrafamiliar y de delitos contra la integridad sexual, utilizando medios electrónicos que alerten de la cercanía del agresor (como por ejemplo, tobilleras).",salir-del-colegio-al-mismo-tiempo-que-los-padres-d,SextoA,2017-11-03T16:46:42.480461Z,proteccion_y_familia,158
434,Matrimonio igualitario incluye adopción homoparental,"- Garantizar que el Ministerio del Interior y Seguridad Publica defina las estrategias y controle el accionar de las policías tal como dicta la Ley, enfocando las acciones de Carabineros en la prevención del delito.

- Crear en Carabineros la especialidad de policía comunitaria dedicada a ejecutar estrategias de reducción del delito, prestar servicios de apoyo a la comunidad y víctimas, y rendir cuentas en los Consejos Comunales de Seguridad Pública. 

- Regular las labores investigativas de la PDI y Carabineros para reducir la descoordinación entre ellas y dar mayor eficiencia al uso de recursos públicos.	
		
- Crear una policía de tránsito, en el nivel regional, que permita liberar a Carabineros de estas tareas que consumen gran cantidad de recursos, con el fin de privilegiar la prevención de los delitos en los territorios.",matrimonio-igualitario-incluye-adopcion-homoparent,MillaraaiA.Escalonaa,2017-11-02T01:53:24.695448Z,diversidad,288
393,Promoción de los Derechos de donación y trasplante de órganos y tejidos,"- Modernizar la Política Nacional de Seguridad Pública Interior, enfocándola en la prevención e incorporando respuestas a los nuevos delitos, definiendo el rol de los gobiernos locales, la participación ciudadana y la responsabilización y rendición de cuentas de las instituciones hacia la ciudadanía.

- Implementar programas de prevención temprana de la violencia y el delito focalizados en niños y adolescentes en riesgo de deserción escolar y de consumo problemático de alcohol y drogas, entre otras vulnerabilidades.
 	
- Fortalecer los Consejos Comunales de Seguridad mediante la entrega de recursos económicos, capacitación de los equipos profesionales y ampliar su instalación a nuevas comunas con problemas socio delictuales.
			
- Mejorar la seguridad de los espacios públicos como plazas y calles incorporando, desde su diseño, criterios de planificación urbana que promuevan la prevención del delito.",que-la-donacion-y-trasplante-de-organos-solidos-y-,Corporacion_Trasplante,2017-10-24T21:27:14.048618Z,salud,61
370,Crear un Sistema Nacional de Seguridad Social Integrado,"- Promover un nuevo Código Penal, ya que el actual es anterior a la Guerra del Pacífico, no sólo para perseguir nuevos delitos, sino que también para graduar su proporcionalidad e incorporar las actuales penas sustitutivas como sanciones principales.
 
- Crear un servicio especializado en la reinserción social de los jóvenes que entregue programas específicos a las necesidades de cada infractor, para reducir la reincidencia y facilitar su reinserción.

- Modificar la Ley de Responsabilidad Penal Adolescente para promover sistemas alternativos de resolución de conflictos penales y corregir falencias del sistema como: la duplicidad de sanciones y falta de regulación del tratamiento de casos que involucran la participación de adultos y niños o jóvenes.

- Promover una Ley de Ejecución de Penas para generar estándares mínimos de control del cumplimiento de las condenas, provisión de programas de reinserción y de transición del medio cerrado al libre y respeto de derechos y deberes de los condenados.

- Fortalecer la función de reinserción social de Gendarmería de Chile, dotándola de capacidades para implementar programas en esta área y mejorar el control del cumplimiento de penas en medio libre que evitan el contagio criminal en las cárceles.",crear-un-sistema-nacional-de-seguridad-social-inte,CUT,2017-10-18T16:24:26.373251Z,asistencia,21
172,Mejorar la calidad de vida de las personas mayores,"- Reponer el deber constitucional del voto y facilitar su ejercicio. Enviar al Congreso una reforma constitucional que reponga este deber cívico, manteniendo la inscripción automática. 
- Enviar un proyecto de modificación de la Ley Orgánica de Votaciones y Escrutinios Populares que explicite el deber del SERVEL de resguardar el derecho a votar de privados de libertad que no se encuentran suspendidos en su ejercicio y otros grupos que pueden tener dificultades en hacerlo.",mejorar-la-calidad-de-vida-de-las-personas-mayores,Mesadedebate,2017-08-23T01:29:07.034925Z,terceraedad,65
833,Anticorrupción para Parlamentarios,"-Fortalecer la participación activa de los trabajadores en las instancias de tripartismo y diálogo social. 
-Instancias como el Consejo Laboral Superior y sus símiles deben adquirir un carácter vinculantes en sus decisiones. 
-Nueva institucionalidad laboral que considere el impacto de la tecnología en la forma de organizar la relación capital-trabajo; los cambios demográficos, la incorporación de trabajadores migrantes, el trabajo informal, el acceso de jóvenes y mujeres al mundo laboral.",anticorrupcion-para-parlamentarios-11,LucianoZC,2020-07-12T08:12:39.398037Z,transparencia,0
822,Crear una ley para limitar y/o eliminar  candidaturas de parlamentarios con antecedentes de corrupción,"•	Se requiere de una ley marco de protección universal de derechos que contenga:
-	Catálogo de derechos
-	Protección administrativa y judicial
-	Institucionalidad que contemple ente rector, política y plan de acción
•	La subsecretaria de la niñez debe ser el ente rector, encargado de organizar la articulación de la respuesta estatal, del diseño de la política y establecimiento de estándares.
•	Lo anterior debe generar cambios en la relación de los adultos con los niños y niñas
•	Generar cambios en los mecanismos y canales de participación de niños y niñas
•	Otro importante cambio debe ocurrir en los servicios de protección especial y responsabilidad penal adolescente, donde es necesario por una parte reformar su institucionalidad, modernizar y flexibilizar los servicios que se entregan, profesionalizar y especializar el trabajo, medir impacto, realizar intervenciones coordinados con las familias, la comunidad y el territorio.",crear-una-ley-para-limitar-yo-eliminar-candidatu-5,LucianoZC,2020-07-12T08:05:21.480919Z,transparencia,0
817,"Crear ley para que Parlamentarios acusados de actos de corrupción o mal manejo de dineros públicos, ya sea con querellas actuales o sobreseidos, no vuelvan a ejercer cargos públicos, de ningún tipo.","●	Propuesta: Agregar a los contenidos mínimos de la malla de educación básica de Chile temas de salud bucal con enfoque en prevención y valoración de la misma.
 
Desarrollo: Trabajar desde el Ministerio de Educación en alianza con el Ministerio de Salud y con la ayuda de expertos tanto en pedagogía como prevención de patologías en salud bucal, contenidos que apunten a generar conciencia del valor de tener buena salud bucal y el impacto de esta en la calidad de vida de los niños, con enfoque en la valoración y cuidado permanente de la salud bucal. Estos contenidos deben ser pertinentes y progresivos según la etapa de desarrollo en que se encuentren nuestros niños.

Justificación: La educación es una de las herramientas más efectivas para llegar a nuestros pequeños, generar cambios culturales y enseñarles sobre la importancia de la autogestión y autocuidado. Orientar la salud bucal hacia un enfoque preventivo comunitario -como se hace en España, Dinamarca y Escocia- afecta positivamente en la disminución del daño evidenciado en temas en la población más joven (Azofeifa, 2010). En general, en temas de salud, es cada vez más evidente el valor de un enfoque preventivo,  para lo cual la educación en estos temas es vital y, si bien en Chile se ha avanzado en este enfoque con programas de vida y alimentación saludable, es necesario adoptar este mismo enfoque en salud bucal por lo cual sería ideal sumar este tema a los Indicadores de Calidad Educativa",crear-ley-para-que-parlamentarios-acusados-de-ac-6,LucianoZC,2020-07-12T08:03:07.741066Z,transparencia,0
811,"Por un gobierno con mas ética, moral y eficiencia.","● 	Propuesta: Plan Dental para mujeres con daño visible y con carga familiar.

Desarrollo: Generar un Plan Dental para mujeres con daño bucal visible que se encuentren buscando trabajo y cuyo daño odontológico sea un impedimento para optar a mejores opciones laborales. Este plan debe ser gratuito siempre y cuando la beneficiaria pase por un proceso de mejora de hábitos de salud bucal, pasando por cursos de capacitación y educación además de comprobar el cambio de hábitos a través de controles regulares durante los 3 meses previos al tratamiento.

Justificación: El estudio de JPal hecho por Gallardo el at (2016) y la experiencia de Fundación Sonrisas han demostrado que la salud bucal de las personas afecta sus posibilidades laborales y que invertir en la salud bucal de aquellos que tienen daño visible es mejor que invertir en capacitaciones, sobre todo en el caso de las mujeres. Asimismo, la sonrisa trae beneficios psicosociales al ser una herramienta que afecta la autoestima, autovalidación y desarrollo personal. Además,  si las mujeres responsables de menores mejoran sus hábitos de higiene bucal  estos hábitos serán transmitidos a las generaciones que hoy se están formando y así cambiaremos la realidad de toda una familia.",por-un-gobierno-con-mas-etica-moral-y-eficiencia,bruno.cardemil,2019-12-04T02:11:26.276673Z,institucionespublicas,1
810,Carne Chilena de Calidad Mundial y Carbono Neutral,"1- Dar una opcion de que cada vez que alguien se sienta ofendido o amenazado tenga la posibilidad de eliminar el comentario.
2- El comentario del agresor debe ser automaticamente eliminado por la red social en cuestión 
3- Si el agresor ha agredido más de una vez se le debe dar una notificación de suspensión temporal de su cuenta y esta debe ser suspendida de acuerdo al tiempo estipulado por la ley. Si fue:
Discriminacion por condicion sexual: el tiempo de suspension debe ser de 4 meses.
Discriminacion por condicion de discapacidad: 4 meses 
Discriminacion por machismo: 4 meses 
Discriminacion por feminismo: 4 meses
Si fue por agresion u ofensa: 3 meses. 
Si fue por amenaza: 8 meses. 
4- Si el acto de discriminacion, amenaza o agresion continúa una vez reabierta la cuenta esta debe ser cerrada automaticamente.",carne-chilena-de-calidad-mundial-y-carbono-neutr-7,taomartineau,2019-09-03T15:39:34.749316Z,sustentabilida,0
803,Promulgación Ley contra el antisemitismo.,"1- El gobierno debe crear  organizaciones que se encarguen de conseguir aportes ciudadanos para financiarles un hogar propio y que cuente con mejores condiciones de vida y no ser obligados a vivir en el Sename.
2- Si es un menor de edad el Estado debe brindarle un medio de acceso al colegio.
3- Si es mayor de edad debe brindarsele medios de apoyo para conseguir empleo.",promulgacion-ley-contra-el-antisemitismo-12,FranciscaAndreaEstayLauria,2019-05-07T04:28:42.468561Z,democracia,0
800,Penalizar toda clase de antisemitismo.,"1- Eliminar el SIMCE ya que se perdió el enfoque inicial.
2- Si se necesita el SIMCE para reformar la eduación crear una prueba cuyo objetivo sea ese y que no esté sometida a un ranking y asi evitar la exclusión por conseguir un mejor puesto.
3. Que en los colegios subvencionados a los /as profesores/as no se les pague un bono dependiendo del puesto que sus alumnos/as obtengan ya que eso es igual motivo de discriminacion.
4. Adecuar la prueba dependiendo de las capacidades de cada estudiante y asi evitar la exclusion.",penalizar-toda-clase-de-antisemitismo-2,FranciscaAndreaEstayLauria,2019-05-07T04:15:28.623518Z,democracia,1
789,Penalización de toda clase de antisemitismo e incitación al odio.,"1- Junto a talleres de distintos brindarles apoyo psicologico ambos obligatorios si no tienen condena perpetua. 
2- Brindarles apoyo educacional para que finalicen sus estudios en la cárcel y fuera de esta a través de un colegio financiado por el Estado que sea para reclusos y reclusas, ex reclusos y ex reclusas y asi puedan después ir a la Universidad y estudiar una carrera y no se involucren en drogas, alcohol, etc...",penalizacion-de-toda-clase-de-antisemitismo-e-in-2,fandreaestayl,2019-04-15T23:16:51.750997Z,democracia,0
787,Penalización de antisemitismo y condecoración a Ariei Bohorodzaner.,"1- Ley de arriendo protegido.
2- Mayor facultad para municipios para fiscalizar y sancionar condiciones de arriendo. 
3- Disminuir el periodo de residencia en el país como requisito de acceso al subsidio de vivienda.",penalizacion-de-antisemitismo-y-condecoracion-a--2,fandreaestayl,2019-04-15T06:49:12.608201Z,democracia,0
785,Avancemos en la Movilidad,"1- Modificar la ley para que los adultos cumplan ambas penas en la cárceles de adultos.
2- Mientras no se modifique esta ley que los menores esten en hogares separados de los adultos",avancemos-en-la-movilidad,EverEnriqueCastrilloChaparro,2019-01-09T21:03:20.445152Z,transporte,1
784,Programa político -social y medioambiental.,"1- Psicólogos y psiquiatras proporcionados por el Estado.
2- Una entidad que sea un canal de comunicación entre los centros Sename y el Estado y vele por el derecho de rehabilitacion de l@s niñ@s y adolescentes del Sename.
3- Si el Estado no da abasto de suficientes especialistas el Estado debe darle a la entidad de Sename anteriormente mencionada automaticamente el poder para autorizar al menor a recibir esta ayuda a través de especialistas privados.
4- la entidad tiene la obligación de proporcionarle al menor esta autorización y bajo ninguna circunstancia a excepción de enfermedad menor (gripe, influenza, etc...) del especialista o del paciente o fallecimiento del especialista o muerte de algún cercano por parte del paciente o profesional esta terapia debe ser pausada o descontinuada hasta que el especialista decida finalizarla.
5- Si el especialista fallece debe ser reemplazado lo antes posible para que la terapia sea lo más constante posible.",programa-politico-social-y-medioambiental,fandreaestayl,2018-10-01T03:29:11.264950Z,medioambiente,0
783,Descentralización parq Valparaíso y otras regiones.,"1- QUE NO TODOS LOS CRÍMENES SE PAGUEN CON DINERO : El que exista una gama tan amplia para pagar fianza es un problema. Es sabido que teniendo suficiente dinero puedes ser absuelto de casi cualquier crimen cometido, o por lo menos, bajar considerablemente su castigo. Esto es terrible, pues tu acceso a los beneficios de la justicia se mide por la cantidad de dinero que tengas y no por tu calidad como ser humano. Por eso creo que debe haber un limite. Aplicar la multa solo hasta ciertos crímenes, lo demás debería ser cárcel o TRABAJO COMUNITARIO.
2- PORCENTAJES MÁS QUE VALORES: Una multa de cien mil pesos es muy diferente entre personas de diferentes realidades económicas (conozco personas que ésta cantidad la dejan de propina en restaurantes) Así que me gustaría ver que se castigase con ""porcentajes"", lo que sería más justo (ejemplo superficial: el 20% de tu renta... haciendo así que el castigo sea equitativo con la realidad económica del inculpado)",descentralizacion-parq-valparaiso-y-otras-regiones,francianestay,2018-06-05T06:17:48.671584Z,descentralizacion,0
782,Penalización a toda clase de violencia y acoso hacia el género femenino.,"1- Una entidad estatal que se preocupe de darles un espacio de divulgación a la violación de sus derechos.
2- Ver la mejor terapia junto a una entidad gubernamental, esta entidad y el o la psicologo/a que esté brindandole apoyo a la victima.
Un presidente que se encargue de brindarle información anual y mensual al director del Sename correspondiente sobre cualquier irregularidad apoyado del resto de la entidad.
3- Una persona que imponga sanciones no judiciales y haga las denuncias judiciales.
4- Despido inmediato de cualquier adulto que haya cometido un acto que atiente contra un niñ@ 
5-  Suspensiones para cualquier adulto que cometa un acto indebido y asi prevenir un acto contra la victima u otro menor.
6- Esta entidad cada 4 años debe cambiar a sus miembros.
7- Si el acto es cometido por un/una menor y no falleció la victima o con riesgo de muerte, el agresor debe recibir terapia y estar privado de contacto con cualquier otro menor hasta la finalización de esta. Si
8- Si hay muerte o riesgo de esta el menor debe estar privado de libertad y recibir terapia de forma permanente",penalizacion-a-toda-clase-de-violencia-y-acoso-h-2,francianestay,2018-05-15T23:54:09.273749Z,derechos,0
780,Empleos para personas de situación vulnerables y de calle.,"1- Una ley que impida que obligue a los presidentes vez desocupado el cargo , se debe seguir valiendo por si mismo economicamente. Y lo que se ahorró pase a un proyecto de aumento de sueldos de quienes viven solamente de los sueldos minimos.
2- una ley que disminuya en al menos un 45% el sueldo de un senador o diputado y el resto del dinero sea ahorrado en un fondo que permita ser solicitado por cualquier emprendimiento que sea un aporte al país.
3- Una ley que aumente en un 30% la multa de ausencia injustificada a una reunión de aprobación de leyes y posteriormente esa cantidad pase a estar ahorrada en un fondo para la mejora de condiciones de vida en las que se encuentran los niños, niñas y adolescentes del Sename.
4- Multa del equivalente al sueldo mínimo por interrupcion de cualquier tipo. El ingreso de esta falta debe ir destinado en compensación al aumento de pensión de alguien, otra parte a la mejora de la salud y otra parte a mejorar el sistema educativo.
5- una ley de multa de $300.000 pesos por atraso a una reunión de aprobación de leyes. Este monto debe ser destinado a campamentos o hacinamientos.",empleos-para-personas-de-situacion-vulnerables-y-d,francianestay,2018-04-18T03:57:32.335640Z,derechos,0
778,Inclusión de Lengua Mapuche en  establecimientos educacionales.,"1- Una ley que obligue al Estado a proporcionarle opciones de vivienda a los inmigrantes que estén en el pais y a los que llegan cada dia.
2- Evaluar periodicamente las condiciones de las viviendas que ofrecen.
3- Aquellos que quieran tener un emprendimiento de vivienda deben tener una autorización en donde aseguren disponer de lo básico(incluyendo espacio adecuado ) para vivir.
4- Cierre en un plazo de dos meses de aquellos emprendimientos que no cuenten con lo solicitado para vivir.
5- Aquellos emprendimientos que ya existen deben ser evaludados y su cuentan con los requisitos, otorgarles un permiso inmediato para funcionar.
6- Aquellos emprendimientos que no cuenten con las condiciones necesarias y tampoco disponen de un permiso, deben expropiarse y pasar al Estado.",inclusion-de-lengua-mapuche-en-establecimientos-ed,francianestay,2018-03-29T23:17:18.019651Z,pueblosoriginarios,0
777,DEMANDAS POR EL CAE Y AMNISTIA,"1, Ley Integral de la Juventud, donde se defina temas prioritarios que sean de interes de los jóvenes ( educación, salud, trabajo, etc)
2. Mejorar la institucionalidad del INJUV, pasando a ser una subsecretaria de la juventud o si se requiere un ministerio, para tener facultades político- administrativas para los jovenes.
3. incentivar la participación de los jovenes en politicas públicas, hoy en dia existe el Gabinete Juvenil hace ya dos años, pero con poca visibilidad política, ni capacidad de instalar temáticas referentes al mismo.  En otros países hay un ""parlamento juvenil"" que presenta propuestas y son vinculadas al parlamento.
4. definir como prioritarios los temas de Salud ( salud sexual y reproductiva y salud mental), Trabajo ( condiciones precariedad de trabajadores jóvenes, inserción al mundo laboral) Educación ( educación continua para jóvenes, financiamiento,  educación no sexista,equilibrio de roles etc). 
5. seguir insentivando a la cultura, pero sin convertirse en una sección de eventos. 
6. Espacios destinados al INJUV, abiertos a los jovenes, solicitandolos o gestiones para ellos. 
7. financiamiento para la juventud.",demandas-por-el-cae-y-amnistia,cerounoceroseis,2018-03-16T17:12:49.556715Z,justicia,1
776,Creación Ley Sophie,"1.	Ciudades Amigables con las Personas Mayores:
Es necesario avanzar en medidas que garanticen la integración, la participación social y la equidad urbana, a través de la planificación sustentable de las ciudades. Para ello es necesario promover el desarrollo de entornos amigables, implementando  el proyecto de “Ciudades amigables con las personas mayores”, a fin de mejorar la calidad de vida de todos los habitantes y especialmente la inclusión social de las personas mayores. Es importante considerar en su implementación la coordinación principalmente entre SENAMA, SENADIS, MINVU, MOP y Ministerio de Transportes de manera de asegurar la consideración de protocolos de diseño y accesibilidad universal. 

2.	Gobiernos locales como diseñadores y ejecutores de políticas urbanas: 
Asimismo es necesario reforzar a los gobiernos locales como diseñadores y ejecutores de políticas urbanas. Es necesario   fortalecer a los municipios para que asuman la responsabilidad de una adecuada gestión del territorio en cuanto a planificación urbana. 

3.	Potenciar la Política Nacional de Desarrollo Urbano y los programas habitacionales existentes:
Se debe incorporar en su gestión las variables de accesibilidad universal y asegurar el avance en la  planificación y construcción de ciudades amigables, equitativas y sustentables que promuevan la participación ciudadana y la integración social. 
4.	Crear beneficios tributarios para las organizaciones que acondicionen sus edificios para personas mayores. (PEP, Política Envejecimiento Positivo)

5.	Generar un subsidio especial para las personas mayores que arrienden primeros pisos preparados para personas mayores. (PEP)

6.	Modificación del Programa de Protección del Patrimonio Familiar, con el objetivo de dar soluciones específicas a grupos con mayor vulnerabilidad social como las personas mayores y discapacitados, mediante la implementación de obras acordes a sus requerimientos específicos (PEP).

7.	Capacitar a los conductores de micros y taxistas de las regiones con más alta concentración de personas mayores acerca de cómo transportarlas y tratarlas. (PEP)

8.	Implementar buses de acercamiento a establecimientos de salud en las comunas más pobres (PEP).

9.	Generar un reglamento sobre el mantenimiento mínimo de los pavimentos urbanos y la construcción de veredas con rampa adecuada. (PEP)

10.	 Crear plazas inclusivas para las personas mayores en cada comuna donde los mayores representan el 20% o más de la población comunal total. (PEP)

11.	Construir bandejones centrales en calles grandes con semáforos no optimizados para que las personas mayores tengan el tiempo adecuado para alcanzar a cruzar la calle. (PEP)

12.	El ministerio de Transporte cuenta con dos tipos de servicios para zonas aisladas del país: buses que pueden ser ocupados por cualquier ciudadano y buses dedicados exclusivamente a escolares. Se propone que todos los servicios de Transporte Estatal de Zonas Aisladas contemplen tarifa diferenciada para personas mayores, de 50% de la tarifa adulto. (PEP)

13.	Levantar un Registro de las zonas con problemas de conectividad, con el fin de priorizar la instalación de servicios de locomoción en estos puntos. (PEP)

14.	Considerar el Programa Servicio Transporte Escolar la posibilidad de que los buses puedan trasladar a personas mayores en horarios distintos a los escolares y la posibilidad de entregarle al Municipio el bus. (PEP)",creacion-ley-sophie,LeslieMoll,2018-02-09T19:28:59.607720Z,infancia,39
