id,title,descripción,slug,proposer,created,clasification,nro_supports
518,Informar e Incentivar la participación ciudadana en la toma de decisiones.,"Implementación de un documento legal de voluntad anticipada que registre las preferencias personales sobre la forma de morir, el cual sea vinculante para las acciones de médicos/as y familiares ante una persona con muerte inminente. A través de este documento se respetaría la autonomía del individuo “al permitirle decidir respecto a las actuaciones sanitarias que desean recibir, o no, en el futuro si se encuentran en unas determinadas circunstancias […] cuando éste no se encuentre en condiciones de expresarla directamente en el momento de necesitar una actuación sanitaria” (Grup D'Opinió de l'Observatori de Bioètica i Dret, 2001). Este tipo de documento ha sido referido en artículos científicos de bioética (véase http://www.scielo.cl/scielo.php?script=sci_arttext&pid=S1726-569X2001000100013)

Algunos de los aspectos que pueden quedar registrados de forma anticipada en este documento:
1. Lugar de muerte: Posibilidad de la persona de ser trasladada por otro a un lugar de preferencia una vez declarada desahuciada -8 de cada 10 chilenos preferiría morir en su hogar, pero 8 de cada 10 muere en hospitales o clínicas (Juan Pablo Beca en EIM 2015)-
2. Extensión artificial de vida: Ser conectado/a o no a máquinas de extensión vital. Que esta decisión si está en el documento no pueda ser contradicha por los familiares o médicos/as.
3. Contexto social: Quiénes deben ser contactados para participar del proceso de muerte de una persona. Que no se asuma a priori que son los familiares (actualmente la familia sigue siendo el núcleo responsable cuando un individuo pierde autonomía)",informar-e-incentivar-la-participacion-ciudadana-e,tallerciencia,2017-11-06T21:46:52.675794Z,participacion,3
517,Repensar la protección de los recursos naturales,"Implementación de un Sistema Nacional de Apoyo y Cuidados, que articule la oferta pública con la de la sociedad civil.",repensar-la-proteccion-de-los-recursos-naturales,tallerciencia,2017-11-06T21:16:16.528620Z,recursosnaturales,8
516,"Modelo Educativo: Estudiantes involucrados activamente en su proceso de aprendizaje (Grupo de Políticas Públicas, Alumni eCh)","Implementación del MNPT, con la convicción de que la única manera de romper el círculo vicioso de la tortura es someter los lugares de detención al escrutinio público, a fin de transparentar lo que ocurre en los lugares de detención y responsabilizar a los agentes estatales de hechos de tortura y malos tratos.
Este Protocolo combina la vigilancia periódica de expertos del mundo entero con visitas más frecuentes de los miembros de los MNPT nacionales. Estas visitas a lugares de detención deben entenderse en un sentido amplio, que incluye cualquier lugar donde haya personas privadas de libertad, tales como hospitales siquiátricos, comisarías, cuca, cárceles, etc. La estrategia que las sustenta se basa en la idea de que cuanto más abiertos y transparentes sean los lugares de detención, menores serán los abusos que ahí se cometen. Al ser los lugares de detención, por definición espacios cerrados y a veces herméticos al mundo exterior, las personas privadas de libertad se encuentran en una situación de vulnerabilidad y de indefensión ante los abusos de toda índole de los que pueden ser objeto, incluyendo la tortura, los tratos crueles inhumanos o degradantes y otras violaciones a derechos humanos.",modelo-educativo-estudiantes-involucrados-activame,ensenachile,2017-11-06T20:30:50.586416Z,educacion,23
515,Reducir horas de colegio,"Implementar educación civica en todos los colegios de chile para poder educar aún mejor a los alumnos. Muchos niños o adolecentes crecen en familias inestables y no tienen con quien conversar sobre algunos temas que hoy en día hacen bastante ruido, por lo que debemos preocuparnos de ellos e informarles sobre diversos temas de los cuales debemos estar informados y tomar una postura ya que nos afecta a todos como ciudadanos de una misma nación, por ejemplo aborto, feminismo, sexualidad, politica, economía, etc... y tambien entregar valores, los cuales no todos obtienen de sus familias y de esta forma formar ciudadanos y ciudadanas más integros.",reducir-horas-de-colegio,MelanieAraya,2017-11-06T01:04:32.242857Z,educacion,2
514,Bajar el precio al medicamento,"Implementar un nuevo sistema de formulación de políticas públicas y toma de decisiones que integre la opinión, aspiraciones y problemáticas de los territorios al gobierno central, mediante una modificación a la actual normativa de participación ciudadana que amplíe su impacto a la vinculación y la deliberación ciudadana desde los territorios, en paralelo a la formación de una nueva institución descentralizada compuesta por la sociedad civil que actué como un SERNAC  ciudadano entre el gobierno, las autoridades políticas y los ciudadanos cuyo objetivo sea fiscalizar la participación ciudadana, el seguimiento a los compromisos de las autoridades en campaña y una rendición de cuenta efectiva en caso de no cumplimiento (Ejemplo: Defensor Ciudadano – Ombudsman).",bajar-el-precio-al-medicamento,MelanieAraya,2017-11-06T00:58:01.274902Z,salud,0
513,Más especializaciones médicas,Implementar ya sea cursos online para los colegios o talleres extra particulares.,mas-especializaciones-medicas,MelanieAraya,2017-11-06T00:53:37.061732Z,salud,0
512,Dejemos el auto,"Impulsar la Política Nacional de Desarrollo Urbano, manteniendo e institucionalizando al Consejo de Desarrollo Urbano como espacio de información, seguimiento y evaluación pública del estado de nuestras ciudades. 
Así también, se requiere acelerar la definición de nuevos estándares urbanos que está trabajando actualmente el Consejo de Desarrollo Urbano.",dejemos-el-auto,MelanieAraya,2017-11-06T00:42:26.906368Z,recursosnaturales,1
511,GRATUIDAD PARA LOS DE BAJO RECURSOS,"Incorporar a la malla educacional instancias dirigidas a la educación sexual, es decir realizar talleres en los establecimientos educacionales estos con presencia y activa participación de los apoderados para lograr un trabajo integral.
La idea es poder implementarlos en niños y niñas desde la pubertad hasta su adolescencia.",gratuidad-para-los-de-bajo-recursos,MariaPerez,2017-11-06T00:15:30.294332Z,institucionespublicas,0
510,Ayudar,"Incorporar en la enseñanza básica y media, contenidos -identificados mediante un levantamiento de las principales necesidades de los emprendedores- que acerquen a los estudiantes al mundo del emprendimiento, potenciando el desarrollo de las habilidades emprendedoras y el conocimiento sobre los trabajos y oficios. 
Hacer partícipe a la comunidad educativa, compartiendo con los estudiantes sus experiencias laborales, sus profesiones y oficios.",ayudar,CristopherKira,2017-11-05T23:23:41.402883Z,proteccion_y_familia,1
509,Mejor salud,"Incorporar un compromiso constitucional en virtud del cual el Estado se comprometa a proteger dentro del marco del orden constitucional, los fundamentos naturales de la vida y de los animales como seres sintientes a través de la legislación y, de acuerdo con la ley y el Derecho, por medio de los poderes ejecutivo y judicial.",salud,CristopherKira,2017-11-05T23:23:41.394727Z,salud,1
508,"Poco compromiso con el voto,  algunos/as  ciudadanos/as no van a votar , ya sea por comodidad o bien por falta de información por quien votar y lugar.","Infraestructura adecuada para ejercer el tratamiento de aguas y otros procesos individuales por cada
vivienda.",poco-compromiso-con-el-voto-algunosas-ciudadanosas,mhurtado,2017-11-05T17:05:58.547021Z,politica,9
507,Embarazo a temprana edad con riesgos para la madre adolescente y el bebé,Iniciar un plan de forestación de la cuenca de Santiago y sus cerros islas. Partiendo por aquellas comunas y zonas que muestran un nivel más bajo de metros cuadrados de áreas verdes por persona. De esa forma se busca aumentar la capacidad de oxigenación del aire de la cuenta a través del trabajo que son capaces de hacer las plantas y árboles.,embarazo-a-temprana-edad-con-riesgos-para-la-madre,mhurtado,2017-11-05T17:05:58.538918Z,salud,7
506,Crisis de contaminación ambiental por basura en ciudades y bolsas de plástico en playas y mar.,"Instaurar un programa de educación cívica con perspectiva de género, feminista y práctico que no sólo se limite al espacio escolar.",crisis-de-contaminacion-ambiental-por-basura-en-ci,mhurtado,2017-11-05T17:05:58.532287Z,medio_ambiente,20
504,La Discriminación  a los niños/as inmigrantes  por la diferencias raciales y de cultura.,Integración de la ciudadanía para la planificación urbana. Es decir que existan consultas ciudadanas vinculantes sobre como queremos habitar la ciudad.,la-discriminacion-a-los-ninosas-inmigrantes-por-la,mhurtado,2017-11-05T17:05:58.519050Z,diversidad,18
503,Falta de acceso al uso de la tecnología en colegios rurales le impide a los alumnos mejorar sus aprendizajes y comunicarse con personas de Chile y mundo.,"Inversión en recursos, espacios y materiales que promuevan el deporte, las artes y la tecnología como herramientas para lograr el desarrollo integral de los niños, niñas y adolescentes.",falta-de-acceso-al-uso-de-la-tecnologia-en-colegio,mhurtado,2017-11-05T17:05:58.512413Z,tecnologia,9
502,"La educación municipal no es buena, al salir  Cuarto Medio los jóvenes no tienen oportunidad para estudios o trabajar, son discriminados por su procedencia.","Invertir en mejoras al equipo docente de las universidades y las mallas curriculares, con enfoques modernos basados en metacognición, así logrando una buena base educativa tendremos alumnos con capacidad de pensamiento autónomo y generar profesionales con competencias útiles a un mundo con necesidad de soluciones. en resumen: Mejores docentes= mejores estudiantes = mejores profesionales = mejor país.
La educación no es nada si es sólo gratuita, debe ser con calidad como prioridad y con capacidad de generar competencias de autonomía si queremos ser un país evolucionado hay que generar competencias pensantes en las futuras generaciones.",la-educacion-municipal-no-es-buena-al-salir-cuarto,mhurtado,2017-11-05T17:05:58.505751Z,educacion_y_trabajo,5
501,"Embarazo adolescente por falta de preocupación de los padres agravado por consumo de drogas, con riesgo de la vida de la madre adolescente y su hijo/a","La aprobación del proyecto legislativo conocido como ""Ley Sayén"", que propone la suspensión de la ejecución pena privativa de libertad para toda mujer embarazada o madre de un niño o niña menor de 3 años, difiriendo su cumplimiento hasta que el o la menor cumpla la mencionada edad.",embarazo-adolescente-por-falta-de-preocupacion-de-,mhurtado,2017-11-05T17:05:58.498149Z,proteccion_y_familia,5
500,Fomentar y apoyar el deporte.,"La asignación de las notarías se puede regular para que se haga de manera transparente, mediante concurso público y por un período acotado de tiempo, sujeto a evaluación de calidad de servicio por parte de los clientes y usuarios.",fomentar-y-apoyar-el-deporte,victor.aliaga,2017-11-05T16:47:32.226282Z,deporte,6
499,colegios gratuitos de calidad y privados,"La causa del problema es que la planificación territorial existentes está regulada por la norma de Urbanismo y Construcción, con un enfoque de uso de suelo urbano y aprovechamiento inmobiliario. Existen otros instrumentos tales como las concesiones marítimas y de acuicultura, Zonificación de Uso del Borde Costero, los Planes de Manejo Forestal, pero todos han sido pensado de manera específica para cierto elemento del medio ambiente o espacio geográfico, y no de forma transversal.


Propuesta

-Legislar sobre la materia, creando un organismo autónomo o dotando a un organismos ya existente, de facultades para aplicar y hacer aplicar a los demás actores de la administración del Estado, las políticas nacionales de planificación territorial.
Este organismo debe estar abocado a la planificación territorial del país, a revisar los distintos sectores donde se estén aplicando decisiones que tengan relación a la planificación territorial.

-Construir la planificación territorial en base a procesos de Participación Ciudadana y al principio de Justicia Ambiental, evitando zonas de sacrificio. 
-Reconocer la importancia de la toma de decisiones a nivel local, respecto de la orientación que la ciudadanía espera de sus propias localidades, lo que se regula a través de los gobiernos regionales y municipios.
-Hacer vinculante las políticas de planificación territorial, en la toma de decisiones de las distintas autoridades, incluyendo especialmente la Evaluación Ambiental.",colegios-gratuitos-de-calidad-y-privados,JavieraFernandez,2017-11-05T14:07:29.954570Z,educacion_y_trabajo,2
498,Aburridos de esperar,"La creación de espacios para reuniones comunitarias
de organizaciones vecinales y el incentivo a la creación de lazos entre las agrupaciones
vecinales rurales y urbanas.",aburridos-de-esperar,dasear13,2017-11-05T13:15:18.298766Z,salud,6
497,Más educación sivica,"La Creación de un Centro de Rescate de Animales, dependiente del Ministerio del Medioambiente y relacionado al Servicio de Biodiversidad y Áreas Protegidas.",mas-educacion-sivica,dasear13,2017-11-05T13:15:18.286493Z,politica,7
496,Educación civica de calidad,"La creación de un comité interministerial con presencia del mundo académico y la sociedad civil organizada, donde se pueda interactuar con representantes del Ministerio de Salud, Educación, de la Mujer y la Equidad de Género y Hacienda, para discutir, evaluar y mejorar las políticas de prevención de VIH/SIDA del país. Este comité debe contar con los recursos materiales y humanos para permitir el cumplimiento de sus funciones, particularmente la generación de insumos sobre la política pública.",educacion-civica-de-calidad,Giselle,2017-11-05T06:31:27.494327Z,educacion,0
495,Ley de reciclaje,"La creación de un Servicio Nacional de Migraciones, con personalidad jurídica, patrimonio propio, descentralizado, desconcentrado territorialmente y directamente subordinado a la Presidencia, mediante un Ministerio.",ley-de-reciclaje,Giselle,2017-11-05T06:05:43.785489Z,medioambiente,2
494,la educacion y trabajo de todos,"La educación es un derecho social que debe tener acceso equitativo ,inclusivista para todos los ciudadanos y no sea competitivo, tal como sucede actualmente.
Mi propuesta es un marco normativo jurídico que implemente un sistema educativo como derecho social para ciudadanos, inclusivo en diversos ámbitos ,se enfoque en materia humanista (valores humanos)y erradicando todo nivel competitivo.
Implememtaria una educación colaborativa, donde exista solidaridad , relaciones humanas entre cuerpos docentes y alumnos, otorgando material dialéctico destinado al ámbito comprensivo y no memorativo de las distintas materias a desarrollar.
También fomentaria la participación inclusiva de todos los actores de establecimientos escolares y educación superior (alumnos,cuerpo docentes, dirección, inspectores y personal),en la toma de decisiones  para un óptimo funcionamiento educacional.
Desarrollaría el fomento de la lectura desde los primeros años escolar en diversas materiales y sobretodo  promulgaria el libre pensamiento.
Finalizará con toda clase de selección y segregacionismo en establecimientos educativo, permitiendo  oportunidades educativos para personas, sin importar su condición económica o social.
Propongo instancias educativas, donde se enseñe a alumnos a compartir con compañeros ,respetarlos  y de esta manera, erradicar todo nivel de bullying y competitividad.",la-educacion-y-trabajo-de-todos,MillarayAnaiis,2017-11-05T01:00:29.185652Z,educacion_y_trabajo,3
493,Salud y bienestar de todos,"La estructura politica-social,  está basada en un excesivo centralismo ,es decir,que se entrega recursos sociales y economicos,a la Región Metropolitana ,pero una de las problemáticas sociales que requieren mayor preocupación y dedicación,es el tema de descentralización en Valparaíso y otras regiones.
Para el desarrollo íntegro,sólido,pleno ,justo y equitativo de Valparaíso y otras regiones, urge una descentralización y distribución de recursos humanos-económicos ,sociales para Valparaiso y otras regionee.
Mi propuesta es crear un marco normativo-juridixo ( decreto y proyecto de ley),que promulgue la descentralización y entrega de recursos para Valparaíso ( y regiones) y en diversos ámbitos. (Social,recursos humanos,económicos , educativo,humanistico y ecológico entre otros).
Además, crearía un organismo que velara por la justa implementación de recursos sociales a diversas regiones (incluida Valparaíso y sancionará toda clase de cohecho .
También desarrollaría y fomentaria mayores  instancia de participación ciudadana (asambleas, charlas ,talleres ,reuniones ,seminariad o exposiciones ),para wru ciudadanos tengan mayor participación ,opinión y decisión en procesos sociales,  destinados al desarrollo y equidad de regiones.",la-salud-y-el-bienestar-de-todos,MillarayAnaiis,2017-11-05T01:00:29.179316Z,salud,4
492,la propuesta del septimo B,La implementación de nuevas políticas enfocadas a la promoción del deporte en todo Chile. Así creando una cultura sana y con una conciencia colectiva y de participación,la-propuesta-del-septimo-b,MillarayAnaiis,2017-11-05T01:00:29.171446Z,diversidad,7
491,Derechos sociales y equidad para comunidad de diversa entidad sexual.,"La inversión Estatal en I+D debe alcanzar el 0.8% del PIB el año 2022.
Además, necesitamos que el proyecto de ley que crea el Ministerio de Ciencia y Tecnología sea aprobado en el congreso antes de agosto del 2018, para que se le considere en el presupuesto de la nación del año 2019 en adelante.",derechos-sociales-y-equidad-para-comunidad-de-dive,Francisca,2017-11-04T23:37:35.685506Z,derechos,1
490,No + Narcos,La Normativa vigente debe asegurar el acceso a salud y seguridad social.,no-narcos,cacevedof,2017-11-04T19:57:10.899860Z,seguridad,0
489,Solidaridad con nuestro pais,"La oficializacion' del nominado proyecto ""Aborto3causales"", que garantiza derecho de mujer a concretar este estereotipo de aborto terapéutico,  prioritozando derecho de la mujer ,por sobre todo estilo de prejuicios o dogmas.
También se requiere implementar una estructura politica-social, que autorice al sistema medicional  ejercer ""aborto3 causales"", poner todos los servicios y medios a su disposición para patentar la dignidad y protección de mujeres,en este tipo de situaciones.
Hay que recordar que el aborto terapéutico se implemento (en Chile), el año 1931 y fue derogado en 1981, por dictadura.
En los casos de violación a adolescentes, no solamente hay que permitir que se ejerza este derecho, sino que   desplegar a su disposición los medios sustentables y dignos ( Sistemas medicod, psicologos,terapeutico, talleres,charlas ,terapeutas ocupacionales) para que la adolescente no sufra ningún tipo de vulnerabilidad a su dignidad,derechos , y este derecho lo extiendo a los 2 casos mencionados.",solidaridad-con-nuestro-pais,KathaCabrera,2017-11-04T19:48:42.677198Z,cultura,10
488,Descentralización .,"La participación comunitaria es esencial en el diseño de parques y plazas, espacios públicos que integran. En esos espacios se promueve el encuentro y la relación entre vecinos, fortaleciendo los vínculos y la vida comunitaria. De esta manera, a través de procesos que logren convocar a los vecinos, se busca conocer la identidad del barrio, identificar necesidades y determinar prioridades. Sólo así será posible la recuperación y/o construcción de nuevas áreas verdes de encuentro que representen a las comunidades, asegurando la apropiación del espacio y un mayor compromiso en el cuidado, uso y mantención de éste.

En el marco de la Ley de Aportes al Espacio Público, se espera que los proyectos identificados como prioritarios por los municipios cuenten con un sistema de participación temprana y vinculante; que contemple metodologías participativas concretas a fin de asegurar que dichos espacios son diseñados y construidos en conjunto a la comunidad. Esto permitirá que sean lugares que respondan a las necesidades de la comunidad y que además ésta colaborará para cuidarlos, pues los consideran como suyos.",descentralizacion,Francisca,2017-11-04T18:59:39.548710Z,descentralizacion,1
487,Protejamos la vida,"La participación es, a la vez, un derecho humano y un principio transversal del conjunto de esos derechos.
El reconocimiento constitucional tiene el valor de colocar la participación dentro del pacto social constitutivo de la sociedad, lo que permitiría el desarrollo de una cultura participativa en coherencia con el marco político-jurídico de la sociedad.",protejamos-la-vida,SebaCastillo,2017-11-04T18:32:30.459814Z,derechoshumanos,0
486,Menos delincuencia y narcotrafico,"La presentación de un decreto-ley que garantice y avale derechos humanos de seres con diversa clase de entidad sexual.
Primeramente, es sumamente esencial que personas con variadas clases de géneros sexuales,  tengan acceso equitativo, como heterosexuales  a todos los servicios y beneficios en numerosos ámbitos (Salud,cultura,educación, académico,y laboral), la creación y generación de diversos espacios (Asambleas,talleres charlas), donde se exponga sobre este tema y la participación de personas con distinta inclinación sexual en ellos), el desarrollo de un manual que reseñe y explique la homosexualidad  y otros distintos géneros, cono opcion sexual, no como  ""enfermedad ""o ""desvarío.""
También considero importante una implementacion educacional integracionista, donde en numerosos establecimientos escolares y de educación superior,  heterosexuales y sujetos humanos de  múltiples opciones sexuales, tengan derechos equitativos y que sean respaldados.",delincuencia-y-narcotrafico,DiegoIgnacio,2017-11-04T16:52:04.033242Z,proteccion_y_familia,13
485,Adopción y matrimonio homosexual,"La propuesta a solución de este problema, es la siguiente;
Crear un departamento o area de fiscalizacion dependiente de la contraloria para hacer auditorias en las distintas organizaciones gubernamentales, que logren identificar que los recursos entregados por el estado sean distribuidos en los presupuestos correspondientes y no se generen boletas falsas ni malas practicas financieras contables.
Para esto reclutaremos a los egresados mas destacados de las carreras de Contador auditor, ingenieros civiles, economistas, Etc. los cuales serán enviados sin previo aviso a estas instituciones con el fin de auditar todos los procesos realizados, este equipo de trabajo sera guiado por una líder experto en auditorias, que no tenga relación con partidos políticos.
Los Egresados que participen en este proceso, se les tomara como sus practicas profesionales y se les becara para una continuidad de estudio.
Esto sera mucho mas transparente, los informes de todas las instituciones del estado.-",adopcion-y-matrimonio-homosexual,MatyRiosFerrada,2017-11-04T14:06:38.024119Z,diversidad,65
484,Más campos y menos edificios,"La propuesta consiste en que en cada declaración de impuestos anual, el SII, diera la opción mediante un formulario web, de dirigir nosotros el 20% del pago de nuestros impuestos (revelar preferencias) a las áreas o ministerios que más nos interesan. Para el caso del que solo paga IVA, porque no está afecto al impuesto a la renta, bajo el mismo portal del SII, podría haber un ícono que le pregunte su renta y le proyecte su gasto de IVA en su consumo, y proceda de la misma manera (formulario), en donde pueda tener derecho a dirigir el 20% de sus tributos pagados a sus áreas de interés.
Todo esto crearía revelación de preferencias, y lo que toman decisiones podrían invertir los recursos de manera más eficiente. También, los candidatos podrían hacer propuestas ""mas al callo"", dada esta revelación de preferencias, y el estado y su administrador de turno, podría hacer una hoja de ruta más coherente con lo que es, y no con lo que en cierto modo, se cree que es.",campos,gonzalitovera,2017-11-04T11:50:08.403384Z,medio_ambiente,26
483,Menos delincuencia,"La propuesta es que para lograr la descentralización, la distribución de impuestos sea porcentual a partir de la concentración de personas por metro cuadrado, por región o mejor aún por comuna y que el porcentaje se calcule y vuelva a fijarse todos los años. De esta forma el costo de vida se debería autoregular, al existir menores impuestos.
El plazo de implementación no debe ser en el corto plazo, para permitir a las empresas y personas poder anticiparse a los cambios.",delincuencia,gonzalitovera,2017-11-04T11:50:08.395384Z,proteccion_y_familia,18
482,Descentralizar partiendo por el estado: Ubicar Ministerios y Agencias en regiones si corresponde.,"La revocación de todas las áreas aptas para la acuicultura (A.A.A) existentes en Áreas Protegidas como Reservas Nacionales, Parques Nacionales, orden que puede ser realizada mediante un decreto emitido por la Subsecretaría de Pesca y Acuicultura del ministerio de Economía.",descentralizar-partiendo-por-el-estado-ubicar-mini,JoseRehbein,2017-11-04T09:22:05.947628Z,descentralizacion,12
481,a que los candidatos cumplan lo que proponen,"la solución a esto seria aumentar el nivel de las sanciones
y preocuparse de la protección y un tratamiento hacia los animales agredidos,golpeados,abandonados..también un punto importante es no adoptar un animal como mascota si no habrá preocupación,empatia,respeto y preocupación por el.",a-que-los-candidatos-cumplan-lo-que-proponen,KimberlyFtSofia,2017-11-03T21:09:05.015381Z,diversidad,70
